{"authoritative_scoring":false,"base_commit_sha1":"11ea682a7f0fadfa1437a12d882402d90ffd0579","base_tag":"m4-wsl2-preexecution-testbed-v1.2","base_tag_object_sha1":"1994709b41c8e108e0b6f9a15936681f596823af","checks":[{"check_id":"IMMUTABLE_BASE_TAG","ordinal":0,"status":"FAIL"},{"check_id":"IMMUTABLE_CHECKOUT","ordinal":1,"status":"NOT_RUN"},{"check_id":"LF_AND_SIDECAR_DISCIPLINE","ordinal":2,"status":"NOT_RUN"},{"check_id":"PYTHON_RUNTIME","ordinal":3,"status":"NOT_RUN"},{"check_id":"PYTHON_DEPENDENCIES","ordinal":4,"status":"NOT_RUN"},{"check_id":"V1_COMPATIBILITY","ordinal":5,"status":"NOT_RUN"},{"check_id":"WSL_GPU_IDENTITY","ordinal":6,"status":"NOT_RUN"},{"check_id":"DOCKER_TOOLKIT_IDENTITY","ordinal":7,"status":"NOT_RUN"},{"check_id":"OCI_PLATFORM_IDENTITY","ordinal":8,"status":"NOT_RUN"},{"check_id":"NO_CUSTODY_NETWORK_MOUNT_CONTROLS","ordinal":9,"status":"NOT_RUN"},{"check_id":"PUBLIC_SYNTHETIC_TESTS","ordinal":10,"status":"NOT_RUN"},{"check_id":"OCI_GPU_VISIBILITY_SMOKE","ordinal":11,"status":"NOT_RUN"}],"custody_access":false,"date":"2026-08-22","failure_code":"TAG_OBJECT_MISMATCH","image_index_digest":"sha256:607442e407b0fea97f8a132a78b787c121a996dd4de181fa08e8da06e71ec2db","image_platform_digest":"sha256:df2607b26bdda2875de4832f4d08da0055b4b6e3570347f3a849bcc652771dd6","inference_executed":false,"network_access":false,"protected_seed_access":false,"recommended_tag":"m4-wsl2-preexecution-testbed-v1.3","regime":"B","schema_version":"m4-wsl2-audit-readiness-report-v1","scientific_evidence":false,"status":"BLOCKED","synthetic_only":true}
